P2P,Ola! Your order from Nando's Riverwalk  is on the grill. Order: 1918/1291717. Queries  267 3600 300.
P2P,Old Orchard near univ. How about you?
P2P,Olol i printed out a forum post by a guy with the exact same  prob which was fixed with a gpu replacement. Hopefully they dont ignore that.
P2P,om.gh/ws/0011901?t=1&kp=2z5z6cx6    Thank you    (send 999 to opt out)
P2P,Omg how did u know what I ate?
P2P,Omg I want to scream. I weighed myself and I lost more weight! Woohoo!
P2P,Omg if its not one thing its another. My cat has worms :/ when does this bad day end?
P2P,Omg it could snow here tonite!
P2P,Omg Joanna is freaking me out. She's looked thru all my friends to find photos of me. And then she's asking about stuff on my MySpace which I haven't even logged on in like a year. :/
P2P,Omg you can make a wedding chapel in frontierville? Why do they get all the good stuff?
P2P,"Omw back to tampa from west palm, you hear what happened?"
P2P,"on 2019-09-20.72.70 MB free which expires on 2019-09-20.,,,,"
P2P,on a Tuesday night r u 4 real
P2P,on Branches to make deposits with your card linked to the account into which you wish to make the deposit. Believe with us.
P2P,on hen night. Going with a swing
P2P,On ma way to school. Can you pls send me ashley's number
P2P,On the road so cant txt
P2P,On the way to office da..
P2P,"Once a fishrman woke early in d mrng. It was very dark. He waited a while &amp; found a sack ful of stones. He strtd throwin thm in2 d sea 2 pass time. Atlast he had jus 1stone, sun rose up &amp; he found out tht those r nt stones, those were diamonds. Moral: Dont wake up early in d mrng'' GOOD night"
P2P,Once free call me sir.
P2P,Once free call me sir. I am waiting for you.
P2P,One day a crab was running on the sea shore..The waves came n cleared the footprints of the crab.. Crab asked: being my frnd y r u clearing my beautiful footprints? Waves replied: A fox was following ur footprints to catch you! thats y i cleared it off:) frndsship never lets u dwn :-) GUD nyt..
P2P,"One of best dialogue in cute reltnship..!!  Wen i Die, Dont Come Near My Body..!! Bcoz My Hands May Not Come 2 Wipe Ur Tears Off That Time..!Gud ni8"
P2P,One of the joys in lifeis waking up each daywith thoughts that somewhereSomeone cares enough tosend a warm morning greeting.. -
P2P,One small prestige problem now.
P2P,One woman dies every 2 miuutes from cervical cancer. awareness month. JANUARY CALL 0501462639/40
P2P,Only 2% students solved this CAT question in 'xam... 5+3+2= &lt;#&gt;  9+2+4= &lt;#&gt;  8+6+3= &lt;#&gt;  then 7+2+5=????? Tell me the answer if u r brilliant...1thing.i got d answr.
P2P,Only if you promise your getting out as SOON as you can. And you'll text me in the morning to let me know you made it in ok.
P2P,"Only just got this message, not ignoring you. Yes, i was. Shopping that is"
P2P,Only once then after ill obey all yours.
P2P,Only saturday and sunday holiday so its very difficult:)
P2P,Onum ela pa. Normal than.
P2P,"Ooh, 4got, i'm gonna start belly dancing in moseley weds 6.30 if u want 2 join me, they have a cafe too. "
P2P,oom enough receive mal
P2P,Oooh bed ridden ey? What are YOU thinking of?
P2P,Oooh I got plenty of those!
P2P,Ooooooh I forgot to tell u I can get on yoville on my phone
P2P,"Oops - am at my mum's in somerset... Bit far! Back tomo, see you soon x"
P2P,"Oops I did have it,  &lt;#&gt; ?"
P2P,Oops i thk i dun haf enuff... I go check then tell ü..
P2P,Oops I was in the shower when u called. Hey a parking garage collapsed at university hospital. See I'm not crazy. Stuff like that DOES happen.
P2P,Oops my phone died and I didn't even know. Yeah I like it better.
P2P,Oops sorry. Just to check that you don't mind picking me up tomo at half eight from station. Would that be ok?
P2P,"Oops your answer is wrong ,Your total points is 7550 Which goalkeeper has kept most clean sheets in La Liga history? A) Andoni Zubizarreta B) Sergio Ramos Reply A or B to win 2500GHC"
P2P,"Oops your answer is wrong ,Your total points is 8050 Who coached Deportivo La Coru?a when they won La Liga in 2000? A) Javier Irureta B) Rafael Ben?tez Reply A or B to win 2500GHC"
P2P,"Oops, I'll let you know when my roommate's done"
P2P,Oops. 4 got that bit.
P2P,"Open rebtel with firefox. When it loads just put plus sign in the user name place, and it will show you two numbers. The lower number is my number. Once you pick that number the pin will display okay!"
P2P,Or ü go buy wif him then i meet ü later can?
P2P,Or better still can you catch her and let ask her if she can sell  &lt;#&gt;  for me.
P2P,Or i go home first lar ü wait 4 me lor.. I put down my stuff first..
P2P,Or I guess  &lt;#&gt;  min
P2P,Or ill be a little closer like at the bus stop on the same street
P2P,Or just do that 6times
P2P,Or maybe my fat fingers just press all these buttons and it doesn't know what to do.
P2P,Or remind me in a few hrs.
P2P,Or u ask they all if next sat can a not. If all of them can make it then i'm ok lor.
A2P,"ORDER N0 : 155 IS READY FOR PICK UP AT LEMA PRESS    Dear Customer,    Your Order No - 155 is ready for pick up.    Print More , Earn More , Redeem More"
P2P,Orh i tot u say she now still dun believe.
P2P,ormation contact us on 0501661180. Glico we cushion you for life.
A2P,"ot your certificate delivered? Share a photo of your envelope package on any social network, mention @theclearinghub and @dhlafrica, use hashtag #nsscertificatedelivery and you stand a chance to win a dinner for two at Kempinski hotel."
P2P,Otherwise had part time job na-tuition..
A2P,Otiden? Start Driving on Bolt to earn good money. Visit our office at 136 Jukwa Road near Wesley Girls High School today at 10am for Instant Activation.
A2P,ou have just earned an additional 5% discount on your next booking. Your discount coupon is 91C23 .
A2P,our 7 days FREE Trial is activated. Enjoy!
A2P,our bank for life
A2P,Our God has the power to turn every mess into a message.  Join SOLUTION HOUR tonight from 7pm as we call on God for a turnaround. Shalom!  #SolutionHour
A2P,Our Prasanth ettans mother passed away last night. Just pray for her and family.
A2P,Our ride equally uneventful - not too many of those pesky cyclists around at that time of night ;).
A2P,"our voicemail by dialling 123, if not already activated"
A2P,ou've canceled your subscription with Appbox Tigo. To rejoin reply OK!
A2P,Package all your programs well
A2P,paid ghs betway reference rt fee ghs new balance ghs trans id mp
A2P,paid ghs betway reference samira amidu fee ghs new balance ghs trans id mp
A2P,paid ghs betway reference ss fee ghs new balance ghs trans id mp
P2P,"Painful words-  I thought being Happy was the most toughest thing on Earth... But, the toughest is acting Happy with all unspoken pain inside.. "
P2P,Pandy joined 4w technologies today.he got job..
A2P,Pansy! You've been living in a jungle for two years! Its my driving you should be more worried about!
A2P,Papaya contains the antioxidant beta-carotene. One study found that beta-carotene offers protection from prostate cancer.
P2P,"Party's at my place at usf, no charge (but if you can contribute in any way it is greatly appreciated) and yeah, we got room for one more"
P2P,Pass dis to all ur contacts n see wat u get! Red;i'm in luv wid u. Blue;u put a smile on my face. Purple;u r realy hot. Pink;u r so swt. Orange;i thnk i lyk u. Green;i realy wana go out wid u. Yelow;i wnt u bck. Black;i'm jealous of u. Brown;i miss you Nw plz giv me one color
P2P,Pathaya enketa maraikara pa'
P2P,Pecha hale le hale ka Mascom M'Booste. Dial *175# to get airtime of up to P30 or 1GB data on credit when you need it. Let us give you a boost.
P2P,"Perhaps * is much easy give your account identification, so i will tomorrow at UNI"
P2P,"Pete,is this your phone still? Its Jenny from college and Leanne.what are you up to now?:)"
P2P,pf warning evaporating pressure bar ga vsd ff anglo gold ashanti obusai mine odd site uma
P2P,PICK UR FONE UP NOW U DUMB?
P2P,Pick you up bout 7.30ish? What time are  and that going?
P2P,"Piggy, r u awake? I bet u're still sleeping. I'm going 4 lunch now..."
P2P,PISS IS TALKING IS SOMEONE THAT REALISE U THAT POINT THIS AT IS IT.(NOW READ IT BACKWARDS)
P2P,"Pity, * was in mood for that. So...any other suggestions?"
P2P,"Play & Win! Dial *787# now for a chance to win Ghs50,000 Jackpot this Saturday & start the New Year with a smile! Your mobile number is your lucky ticket."
P2P,Play w computer? Aiyah i tok 2 u lor?
P2P,"Playin space poker, u?"
P2P,please approve following loading permit customername ackah baidoo group companiesgrade gradequantity 
P2P,Please ask mummy to call father
P2P,Please attend the phone:)
P2P,Please da call me any mistake from my side sorry da. Pls da goto doctor.
P2P,Please dont say like that. Hi hi hi
P2P,Please don't text me anymore. I have nothing else to say.
P2P,Please enter 417796 into LINE within the next 30 mins.
P2P,Please give it 2  or i will pick it up on Tuesday evening about 8 if that is ok.
P2P,Please leave this topic..sorry for telling that..
P2P,Please note GHS 320.00 was credited to Acc. ending 9700. Your available balance is now GHS 352.55
P2P,Please note that you are about to reach your credit limit of 10000.00. For possible credit limit increase on your card please call 267-3159575.
A2P,"Please protect yourself from e-threats. SIB never asks for sensitive information like Passwords,ATM/SMS PIN thru email. Never share your password with anybody."
P2P,Please reserve ticket on saturday eve from chennai to thirunelvali and again from tirunelvali to chennai on sunday eve...i already see in net..no ticket available..i want to book ticket through tackle ..
P2P,Please sen :)my kind advice :-)please come here and try:-)
P2P,Please tell me not all of my car keys are in your purse
P2P,Please tell me you have some of that special stock you were talking about
P2P,PLEASSSSSSSEEEEEE TEL ME V AVENT DONE SPORTSx
A2P,Pls accept me for one day. Or am begging you change the number.
P2P,Pls ask macho how much is budget for bb bold 2 is cos i saw a new one for  &lt;#&gt;  dollars.
P2P,Pls call me da. What happen.
P2P,Pls clarify back if an open return ticket that i have can be preponed for me to go back to kerala.
P2P,Pls come quick cant bare this.
P2P,Pls confirm the time to collect the cheque.
P2P,Pls dont forget to study
P2P,Pls dont restrict her from eating anythin she likes for the next two days.
P2P,Pls give her prometazine syrup. 5mls then  &lt;#&gt; mins later feed.
P2P,Pls give her the food preferably pap very slowly with loads of sugar. You can take up to an hour to give it. And then some water. Very very slowly.
P2P,Pls go ahead with watts. I just wanted to be sure. Do have a great weekend. Abiola
P2P,Pls go there today  &lt;#&gt; . I dont want any excuses
P2P,Pls help me tell Ashley that i cant find her number oh
P2P,Pls help me tell sura that i'm expecting a battery from hont. And that if should pls send me a message about how to download movies. Thanks
P2P,Pls i wont belive god.not only jesus.
P2P,Pls pls find out from aunt nike.
P2P,"Pls send me a comprehensive mail about who i'm paying, when and how much."
P2P,Pls send me the correct name da.
P2P,Pls send me your address sir.
P2P,Pls she needs to dat slowly or she will vomit more.
P2P,Pls speak to that customer machan.
P2P,Pls speak with me. I wont ask anything other then you friendship.
P2P,Pls tell nelson that the bb's are no longer comin. The money i was expecting aint coming
P2P,Pls what's the full name of joke's school cos fees in university of florida seem to actually be  &lt;#&gt; k. Pls holla back
P2P,"Plz note: if anyone calling from a mobile Co. &amp; asks u to type # &lt;#&gt;  or # &lt;#&gt; . Do not do so. Disconnect the call,coz it iz an attempt of 'terrorist' to make use of the sim card no. Itz confirmd by nokia n motorola n has been verified by CNN IBN."
P2P,Po de :-):):-):-):-). No need job aha.
P2P,points are automatically converted into discounts on subsequent printings as per below
P2P,Poor girl can't go one day lmao
P2P,Post and promote your ads to get more sales on tonaton. Contact us on 0552570280 should you need any assistance.
P2P,"Poyyarikatur,kolathupalayam,unjalur post,erode dis, &lt;#&gt; ."
P2P,Prabha..i'm soryda..realy..frm heart i'm sory
P2P,"Praise God, Pls note: 1. Area Head meets ALL OFFICERS   5pm this evening. 2. Seminar for all musicians: Chorus ldrs, instrumentalists, soloists, choirs,"
P2P,Prakesh is there know.
A2P,PRAYER AND FASTING DAY 5  PRAY THAT THE HOLY SPIRIT OUR HELPER WILL GIVE US A HEART THIRSTY FOR GOD.  PRAY THAT THE HOLY SPIRIT WILL BRING CONVICTION UPON OUR HEARTS ANY TIME WE HEAR THE WORD OF GOD.  PRAY THAT GOD WILL SEND HIS REVIVAL FIRE UPON -GTP.
P2P,Prepare to be pleasured :)
P2P,Prepare to be pounded every night...
P2P,President Akufo-Addo has urged the country?s security agencies to deal with any group of persons who will attempt to cause mayhem during this year?s elections.
P2P,PREVAILING TIME continues this Saturday at 7am prompt. It is a moment to receive the word of God and pray. Come and let us prevail together. Invite someone.
P2P,"Princess, i like to make love  &lt;#&gt;  times per night. Hope thats not a problem!"
P2P,"Princess, is your kitty shaved or natural?"
P2P,Printer is cool. I mean groovy. Wine is groovying
P2P,Probably a couple hours tops
P2P,Probably earlier than that if the station's where I think it is
P2P,"Probably gonna be here for a while, see you later tonight &lt;)"
P2P,Probably gonna swing by in a wee bit
P2P,Probably money worries. Things are coming due and i have several outstanding invoices for work i did two and three months ago.
P2P,"Probably not, I'm almost out of gas and I get some cash tomorrow"
P2P,"Probably not, still going over some stuff here"
P2P,"Probably, want to pick up more?"
P2P,"processed and paid by Botswana Life. For convenience, members are now allowed to submit their claims at any nearest Botswana Life branches across the co"
P2P,Prof: you have passed in all the papers in this sem congrats . . . . Student: Enna kalaachutaarama..!! Prof:???? Gud mrng!
A2P,prompt acct ** date desc visa purchase capecoast gh amt ghs branch curr avail bal type credit
A2P,prompt acct ** date desc visa purchase imperial peki imperial peki gh amt ghs branch curr avail bal type debit
A2P,prompt acct ** date desc visa purchase itunes com itunes com
P2P,PS U no ur a grown up now right?
P2P,"Pupils/students start End of term 3 Exam God willing tomorrow and go home on Friday, 2nd August at 10am God willing."
A2P,purchase completed please try confirm mobile money payment play reference number bb ebc fd bc
P2P,Purity of friendship between two is not about smiling after reading the forwarded message..Its about smiling just by seeing the name. Gud evng musthu
P2P,Que pases un buen tiempo or something like that
P2P,Quite late lar... Ard 12 anyway i wun b drivin...
P2P,Quite lor. But dun tell him wait he get complacent...
P2P,Quite ok but a bit ex... U better go eat smth now else i'll feel guilty...
P2P,R ü comin back for dinner?
P2P,R ü going 4 today's meeting?
P2P,R U &SAM P IN EACHOTHER. IF WE MEET WE CAN GO 2 MY HOUSE
P2P,R u here yet? I'm wearing blue shirt n black pants.
P2P,R u in this continent?
P2P,R u meeting da ge at nite tmr?
P2P,R u over scratching it?
P2P,R u saying i should re order the slippers cos i had to pay for returning it.
P2P,R u still working now?
P2P,R u sure they'll understand that! Wine * good idea just had a slurp!
P2P,R we going with the  &lt;#&gt;  bus?
P2P,R we still meeting 4 dinner tonight?
P2P,"Radiant One, today is Day 5 of our Daniel Fast. Scripture for today is Isaiah 3"
P2P,Raji..pls do me a favour. Pls convey my Birthday wishes to Nimya. Pls. Today is her birthday.
P2P,Ranjith cal drpd Deeraj and deepak 5min hold
P2P,Rats. Hey did u ever vote for the next themes?
P2P,Raviyog Peripherals bhayandar east
P2P,Re your call; You didn't see my facebook huh?
P2P,READING FOR THE DAY  Genesis 18 Matthew 17 Nehemiah 7 Acts 17  The Anointing to take new territory is upon you
P2P,Reading gud habit.. Nan bari hudgi yorge pataistha ertini kano:-)
P2P,Really do hope the work doesnt get stressful. Have a gr8 day.
P2P,Really dun bluff me leh... U sleep early too. Nite...
P2P,Really good:)dhanush rocks once again:)
P2P,Really... I tot ur paper ended long ago... But wat u copied jus now got use? U happy lar... I still haf 2 study :-(
P2P,Really? I crashed out cuddled on my sofa.
P2P,Realy sorry-i don't recognise this number and am now confused :) who r u please?! 
P2P,Reason is if the team budget is available at last they buy the unsold players for at base rate..
A2P,received ghs ad ea ccde reference new balance ghs trans id gm
A2P,received ghs ad fbd reference infinity data bundle mfs new balance ghs trans id dp
A2P,received ghs ad fdd reference cast vote gh new balance ghs trans id mp
A2P,received ghs adff da ff ac reference infinity data bundle mfs new balance ghs trans id dp
A2P,received ghs adff da ff ac reference unlimited calls new balance ghs trans id mm
A2P,received ghs jesuit ayi ismael ayayee curr bal ghc avail bal ghc trans id pp
A2P,"Received, understood n acted upon!"
A2P,"Recharge with P5 or more between now and the 4th of June and get 100% of your first recharge amount as Freebie. Mascom, Number 1 because of you"
A2P,Reckon need to be in town by eightish to walk from * carpark.
A2P,Reg 002: 04-Jun-21 Day P'000: 2837 Day Growth LFL: -13.5% MTD LFL: -26.6% Day Bud: 87.3% Week Bud: 78.1% MTD Bud: 78.1% CO Bud: 105.5% In: 22% Stores: 73
A2P,Registration of Account Number 575343387 is successfull.
A2P,Reject/Retract HIGH on ATM GH1018. Date 07/22/19 05:21. See Incident ID 7234362
A2P,"Remember all those whom i hurt during days of satanic imposter in me.need to pay a price,so be it.may destiny keep me going and as u said pray that i get the mind to get over the same."
A2P,Remember forgetting to take your drugs can prolong healing.
A2P,Remember on that day..
A2P,Remember to ask alex about his pizza
A2P,Remind me how to get there and I shall do so
A2P,Repayment failed. Kindly try again. Call 0307020707 for assistance.  Ref. ID: 15637
A2P,Requested amount not in multiple of allowed value
A2P,Revenue did not populate at 10am. Check!
A2P,Reverse is cheating. That is not mathematics.
A2P,Right it wasnt you who phoned it was someone with a number like yours!
A2P,"Right on brah, see you later"
A2P,Rightio. 11.48 it is then. Well arent we all up bright and early this morning.
A2P,rmc mac arthur evelyn received joint tithe payment desc tithe dec amount ghs rcpt date january received patricia arhin god bless
A2P,rmc nsarkoh charles kweku received joint tithe payment desc tithe dec amount ghs rcpt date january received patricia arhin god bless
A2P,rmc obiri yeboah foster received joint tithe payment desc cancellation tithe receipt number amount ghs rcpt date january received patricia arhin god bless
A2P,rmc yeboah dorcas received joint tithe payment desc tithe nov dec amount ghs rcpt date january received maxwell ofori god bless
A2P,rmerly cdh asset management ltd atomic junction branch information claim communicated due course kindly call require clarification thank
P2P,roadside assistance request phone number car location wassa ateiku wassa east district western region car number aw problem assess damages provide estimate repairs
P2P,roaming voice ivorycoast
P2P,Rofl betta invest in some  anti aging products
P2P,Rofl. Its true to its name
P2P,Roger that. Were probably going to rem in about 20
A2P,"ROMANTIC POEM: Love is feeling cold in the back of vans, Love is a fan club with only two fans, Love is walking holding paint stained hands, Love is fish"
P2P,Ron say fri leh. N he said ding tai feng cant make reservations. But he said wait lor.
P2P,"Rose for red,red for blood,blood for heart,heart for u. But u for me.... Send tis to all ur friends.. Including me.. If u like me.. If u get back, 1-u r poor in relation! 2-u need some 1 to support 3-u r frnd 2 many 4-some1 luvs u 5+- some1 is praying god to marry u.:-) try it...."
P2P,"Rose needs water, season needs change, poet needs imagination..My phone needs ur sms and i need ur lovely frndship forever...."
P2P,Ryder unsold.now gibbs.
P2P,s are automatically converted into discounts on subsequent printings as per below
P2P,S but mostly not like that.
P2P,S but not able to sleep.
P2P,S da..al r above  &lt;#&gt;
P2P,S name. TIME : 6PM - 7PM  @ GRAND VIEW HOTEL.COME AND MEET WITH JESUS AND YOUR LIFE WILL NOT BE THE SAME.
P2P,S now only i took tablets . Reaction morning only.
P2P,S s..first time..dhoni rocks...
P2P,S....s...india going to draw the series after many years in south african soil..
P2P,S...from the training manual it show there is no tech process:)its all about password reset and troubleshooting:)
P2P,S...i will take mokka players only:)
P2P,S..antha num corrct dane
P2P,S.i think he is waste for rr..
P2P,S.i'm watching it in live..
P2P,S.s:)i thinl role is like sachin.just standing. Others have to hit.
P2P,S.this will increase the chance of winning.
P2P,S:)8 min to go for lunch:)
P2P,S:)but he had some luck.2 catches put down:)
P2P,S:-)if we have one good partnership going we will take lead:)
P2P,S:-)kallis wont play in first two odi:-)
P2P,S:)no competition for him.
P2P,S:)s.nervous  &lt;#&gt; :)
P2P,S269_Major Components Replacement  Aux Equipments Status:  Graders: 558> Down  Track dozers:  578 - Ready 581-Ready 583 -Reday 584 -Ready 587 -Ready 588 -Ready 589 -Ready 592-Ready 594-Ready  Rubber tyre dozers:523  Bowers:All Read
P2P,Sac needs to carry on:)
P2P,Sac will score big hundred.he is set batsman:-)
A2P,"Sad story of a Man - Last week was my b'day. My Wife did'nt wish me. My Parents forgot n so did my Kids . I went to work. Even my Colleagues did not wish. As I entered my cabin my PA said, '' Happy B'day Boss !!''. I felt special. She askd me 4 lunch. After lunch she invited me to her apartment. We went there. She said,'' do u mind if I go into the bedroom for a minute ? '' ''OK'', I sed in a sexy mood. She came out 5 minuts latr wid a cake...n My Wife, My Parents, My Kidz, My Friends n My Colleagues. All screaming.. SURPRISE !! and I was waiting on the sofa.. ... ..... ' NAKED...!"
A2P,safety young children like put things mouths prevent choking small objects coins nuts buttons kept reach
A2P,"Salary Payment Voucher for July, 2019 is ready for validation. Kindly log on to www.gogspv.com to validate your Payment Voucher.Validation ends 8am 24/07/19"
P2P,Same as kallis dismissial in 2nd test:-).
P2P,Same as u... Dun wan... Y u dun like me already ah... Wat u doing now? Still eating?
P2P,Same boring aswell just for the Ghana Card..
P2P,"Same here, but I consider walls and bunkers and shit important just because I never play on peaceful but I guess your place is high enough that it don't matter"
P2P,Same to u...
P2P,"Same, I'm at my great aunts anniversary party in tarpon springs"
P2P,Same. Wana plan a trip sometme then
A2P,sarah adjetey sent ghs mtn mobile money account send receive money instantly expresspay www expaygh com app
A2P,sarfo purchased ghs airtime download palmpay get rewards buy airtime https palmpay page link kr
P2P,Sary just need Tim in the bollox &it hurt him a lot so he tol me!
P2P,Sat right? Okay thanks... 
A2P,sati bharwani sent ghs mtn mobile money account send receive money instantly expresspay www expaygh com app
A2P,save time download fidelity mobile app http goo gl atqhau dial banking needs
A2P,"Save yourself the stress. If the person has a dorm account, just send your account details and the money will be sent to you."
A2P,saving booster contribution ghs successful please note may take hours reflect contributions online thanks
A2P,savvy pabi transferred ghs expresscard login use funds send money buy airtime internet data go
P2P,Saw Guys and Dolls last night with Patrick Swayze it was great
A2P,say thank part family business us contact us great deals send reviews help serve better
P2P,say thanks2. 
A2P,"Say this slowly.? GOD,I LOVE YOU &amp; I NEED YOU,CLEAN MY HEART WITH YOUR BLOOD.Send this to Ten special people &amp; u c miracle tomorrow, do it,pls,pls do it..."
A2P,says the  &lt;#&gt;  year old with a man and money. I'm down to my last  &lt;#&gt; . Still waiting for that check.
A2P,sboard tip# expect discouraged pursuit excellence fruits desirable many find process demands unattractive
A2P,scheduled gigm pick knust bus stop please note show without prior reschedule renders ticket void
A2P,scheduled report midnight credit bureaus banks money lenders repay outstanding amount ghs today
P2P,school fees academic year creche gh kg gh gh gh gh gh gh gh
P2P,school opens shs shs green track shs today th jan shs students pay cedis passport pictures wassce registration
P2P,school opens tomorrow monday th jan pupils report said date meanwhile pupils arrears fees last term come
P2P,"Science tells that chocolate will melt under the sunlight. Please don't walk under the sunlight. BCoz,I don't want to loss a sweet friend."
A2P,scofray nana yaw yeboah sent gb data via expresspay click www expaygh com app send money buy airtime internet data go
A2P,scorpion sent ghs mtn mobile money account send receive money instantly expresspay www expaygh com app
P2P,scratch card ghc airteltigo money ghc
P2P,Sday only joined.so training we started today:)
A2P,se branch information claim communicated due course kindly call require clarification thank
A2P,sebastian anetey shamo sent ghs mtn mobile money account send receive money instantly expresspay www expaygh com app
P2P,second msisdn blank
P2P,second msisdn invalid length
A2P,second msisdn registered mobiquity network
A2P,second notification close site kpong please close site soon possible
A2P,second notification ruffai salifu close site kpong yet please notify user close site
A2P,seconds airteltigo xtra time minutes fuse mins local calls fuse mins local calls fuse mins local calls mb
