P2P,Ard 515 like dat. Y?
P2P,Ard 530 like dat lor. We juz meet in mrt station then ü dun haf to come out.
P2P,Ard 530 lor. I ok then message ü lor.
P2P,Ard 6 like dat lor.
P2P,ards to learn. Thank You.
P2P,Are there TA jobs available? Let me know please cos i really need to start working
P2P,Are u awake? Is there snow there?
P2P,Are u coming to the funeral home
P2P,Are we doing the norm tomorrow? I finish just a 4.15 cos of st tests. Need to sort library stuff out at some point tomo - got letter from today - access til end march so i better get move on!
P2P,Are you angry with me. What happen dear
P2P,Are you at work right now ?
P2P,Are you available for soiree on June 3rd?
P2P,"Are you being good, baby? :)"
P2P,Are you coming to day for class.
P2P,Are you driving or training?
P2P,Are you free now?can i call now?
P2P,Are you going to wipro interview today?
P2P,Are you going to write ccna exam this week??
P2P,Are you happy baby ? Are you alright ? Did you take that job ? I hope your fine. I send you a kiss to make you smile from across the sea ... *kiss* *kiss*
P2P,Are you having challenges with your Forex Trading? Do you need help with signals? Forex Hub gives FREE Forex signals for a month. To help you in your for
P2P,Are you in castor? You need to see something
P2P,ARE YOU IN TOWN? THIS IS V. IMPORTANT
P2P,Are you not around or just still asleep? :V
P2P,Are you ok. What happen to behave like this
P2P,Are you planning to come chennai?
P2P,Are you plans with your family set in stone ?
P2P,Are you staying in town ?
P2P,Are you still getting the goods.
P2P,Are you still playing with gautham?
P2P,"Are you sure you don't mean  get here, we made you hold all the weed "
P2P,Are you the cutest girl in the world or what
P2P,Are you there in room.
P2P,Are you this much buzy
P2P,Are you up for the challenge? I know i am :)
P2P,Are you wet right now?
P2P,Are you willing to go for apps class.
P2P,Are you willing to go for aptitude class.
P2P,Are your freezing ? Are you home yet ? Will you remember to kiss your mom in the morning? Do you love me ? Do you think of me ? Are you missing me yet ?
P2P,"Argh my 3g is spotty, anyway the only thing I remember from the research we did was that province and sterling were the only problem-free places we looked at"
P2P,Argh why the fuck is nobody in town ;_;
A2P,ARINZE IGWILO.  ACCT NO. 65262623. SORT CODE. 040004. MONZO BANK. Â£1000.
P2P,Armand says get your ass over to epsilon
P2P,armed please check whether deposited money today total balance please 
P2P,"Arms fine, how's Cardiff and uni? "
P2P,"arned her never to send u .5m but all her pay n pay d debit bal. well. Also get all credited sales. Plse God grant u PATIENCE, PLEASE. THANK U VERY MUCH. GMA"
P2P,"Arngd marriage is while u r walkin unfortuntly a snake bites u. bt love marriage is dancing in frnt of d snake &amp; sayin Bite me, bite me."
P2P,around kindly get touch since pm 
P2P,Around the Accra Mall... Wish the car would branch as if he's going to Tema so I can come and see you sweetheart
P2P,ARR birthday today:) i wish him to get more oscar.
P2P,arrived safely thank pk 
P2P,Arsenal defender Konstantinos Mavropanoswill have a medical with German second division club FC Nurnberg on Monday ahead of a loan move.
P2P,Arun can u transfr me d amt
P2P,"As I entered my cabin my PA said, '' Happy B'day Boss !!''. I felt special. She askd me 4 lunch. After lunch she invited me to her apartment. We went there."
P2P,As if i wasn't having enough trouble sleeping.
P2P,As in different styles?
P2P,As in i want custom officer discount oh.
P2P,"As in missionary hook up, doggy hook up, standing...|"
P2P,As per your request 'Maangalyam (Alaipayuthe)' has been set as your callertune for all Callers. Press *9 to copy your friends Callertune
A2P,As per your request 'Melle Melle (Oru Minnaminunginte Nurungu Vettam)' has been set as your callertune for all Callers. Press *9 to copy your friends Callertune
P2P,As usual u can call me ard 10 smth.
P2P,"As usual..iam fine, happy &amp; doing well..:)"
A2P,asalam alekum calling inform applied anti terrorist code rev 
P2P,Asante Kotoko have been banned temporarily from using the Baba Yara Stadium for their home matches in the GPL following Sunday's misconduct by fans.
A2P,asantewaa tenkorang sent ghs mtn mobile money account send receive money instantly expresspay www expaygh com app
A2P,asare purchased ghs airtime download palmpay get rewards buy airtime https palmpay page link kr
A2P,asbeak educational complex wish thank payment child school fees enrolling child dear school 
A2P,ase branch information claim communicated due course kindly call require clarification thank
A2P,ase note feeding optional thank management nllc
A2P,asebi lib ar battery theft alarm open
A2P,asebi lib ar dc system door open alarm open
A2P,aseye kutsoati sent ghs airtime via expresspay click www expaygh com app send money buy airtime internet data go
P2P,ash town short money please get ghc go back 
A2P,ashaiman accra gh current balance ghs save time download fidelity mobile app http goo gl atqhau dial
A2P,ashaiman branch atm issue cash cassette warning cash vol balance less cassette type media cassette type media low
P2P,"Ask g or iouri, I've told the story like ten times already"
P2P,ask self life better may lord change behavior 
P2P,Asking do u knw them or nt? May be ur frnds or classmates?
P2P,Aslamalaikkum....insha allah tohar beeen muht albi mufti mahfuuz...meaning same here....
P2P,asomdwe enka wo bspg meeting resume today please miss see pm god richly bless 
A2P,"Assalaamu alaikum warahamattullah. ASWAJ shama district,  monthly executive meeting, this sunday 19 Jan 2020 at shama junction central mosque. Time @ 12"
A2P,assalamu alaikum please note zakat committee meeting sunday th january thank 
A2P,assin fosu postbank branch diagnostics
A2P,assin fosu postbank branch offline required online
P2P,assistance thank
A2P,assroom students must sew prescribed school uniform attire used henceforth #sarkodie creations
A2P,ast time came could tell stop thinking thank kk 
P2P,At 4. Let's go to bill millers
P2P,At 7 we will go ok na.
P2P,At bank
P2P,at bruce b downs &amp; fletcher now
P2P,At home also.
P2P,At home by the way
P2P,At home watching tv lor.
P2P,At my workplace.  Haha oh I can't come to your branch.
P2P,At the funeral home with Audrey and dad
P2P,At what time are you coming.
P2P,At WHAT TIME should i come tomorrow
P2P,atebubu ba battery theft alarm open
P2P,atebubu ba dc system door open alarm open
P2P,ation alone killing humble request wait till end month hope understand plight god bless
A2P,atm cash withdrawal visa accra acct xxxxx debited ghs balance ghs use ghl mortgage buy house bijou homes www bijouhomesgh com
A2P,atm changed mode closed service
A2P,atm changed mode line closed
A2P,atm changed mode service closed
A2P,ATM Heartbeat Not Received on ATM GH0005. Date 07/22/19 04:08. See Incident ID 7234146
A2P,ato kwamena dadzie sent ghs mtn mobile money account send receive money instantly expresspay www expaygh com app
A2P,atobiase cr dc system door open alarm open
A2P,atomic junction branch information claim communicated due course kindly call require clarification thank
A2P,atonsu branch diagnostics
A2P,atqhau dial banking needs
A2P,atso accra gh current balance ghs save time download fidelity mobile app http goo gl atqhau dial banking needs
A2P,Att: EMMANUEL NUAKOH Terminal: 10000127 Fault ID: 13716543 T'di harbour Branch 2 ATM Heartbeat Not Received T'di harbour Branch 2 HBDEAD 07/22/19 06:23
A2P,atta purchased ghs airtime download palmpay get rewards buy airtime https palmpay page link kr
A2P,atu mould sent ghs mtn mobile money account send receive money instantly expresspay www expaygh com app
A2P,au dial banking needs
A2P,aubrey aidoo sent ghs airteltigo money account send receive money instantly expresspay www expaygh com app
A2P,audrey mireku sent ghs mtn mobile money account send receive money instantly expresspay www expaygh com app
P2P,Audrie lousy autocorrect
A2P,augustine asare sent mb data via expresspay click www expaygh com app send money buy airtime internet data go
A2P,augustine purchased ghs airtime download palmpay get rewards buy airtime https palmpay page link kr
A2P,augustine wireko asubonteng sent ghs mtn mobile money account send receive money instantly expresspay www expaygh com app
A2P,augustt selorm sent ghs mtn mobile money account send receive money instantly expresspay www expaygh com app
P2P,aunt pat pls thank 
P2P,auntie barbara good morning hope good please make order bottles black shitto ghs delivery friday 
P2P,Auntie huai juan never pick up her phone
P2P,aunty doris please waiting time tomorrow class kindly help patience 
P2P,aunty rita god bless may every single minute life blessed may fruit womb blessed 
P2P,"Austin, wish Obiri Yaw Twum a happy birthday today"
P2P,authentication code rpmvrbj
P2P,authentication otp jqqu expire seconds
A2P,auto renewal expires
P2P,auto renewal expires mb data expiry
A2P,auto renewal expires mb mb auto renewal expires
P2P,auto renewal valid till
A2P,auto renewal valid till fuse mins local calls fuse mins local calls
A2P,auto renewal valid till fuse mins local calls mb fuse data fuse bundles expire
A2P,auto sent please click https palmpay page link xaud collect money hours
A2P,automatic operator channel successful transaction amount ghs trasaction id ao ref charges ghs commission ghs new balance ghs mfs provider name airteltigomoney txn amount tax ghs service charge tax ghs commission tax ghs total tax paid ghs
A2P,av akwasi dab pacific credited transfer credit cedi balance cedi thank
A2P,avail bal type debit
A2P,available thank choosing tingg http bit ly tingg home
A2P,avbl bal xxxx inr combined avbl bal inr use mobile banking app track app kotak com
P2P,ave sealed the one for the ADB and that's the one you will give to the bank after you have talked to Mr George(the valuation officer). I have given your
P2P,Awesome question with a cute answer: Someone asked a boy  how is ur life?  . . He smiled &amp; answered: . .  She is fine!  Gudnite
P2P,"Awesome, be there in a minute"
P2P,"awesome, how do I deal with the gate? Charles told me last night but, uh, yeah"
P2P,"Awesome, I remember the last time we got somebody high for the first time with diesel :V"
P2P,"Awesome, I'll see you in a bit"
P2P,"Awesome, lemme know whenever you're around"
P2P,"Awesome, plan to get here any time after like  &lt;#&gt; , I'll text you details in a wee bit"
P2P,"Awesome, text me when you're restocked"
P2P,"Awesome, that gonna be soon or later tonight?"
P2P,"Awesome, think we can get an 8th at usf some time tonight?"
P2P,Aww that's the first time u said u missed me without asking if I missed u first. You DO love me! :)
P2P,Aww. Thank u so much.
P2P,Awww dat is sweet! We can think of something to do he he! Have a nice time tonight ill probably txt u later cos im lonely :( xxx.
P2P,"Awww it's sad to see you go but you can always come back by sending RED or BLUE to 470 for 40p a day. Who knows? You can win GHC 100,000!"
P2P,Awww no problem just that l met a difficult customer being handled by you. Even after l the banking hall l saw him standing outside quietly appearing not satisfied.  Have a blessed day and expect my around 10
P2P,awww sad see go always come back sending red blue day knows win ghc
P2P,Ay wana meet on sat?ü wkg on sat?
A2P,ayi position click https gd oqkbpl detailed report download gbook mobile app access child reports http bit ly gbook
A2P,ayment select repay fido loan enter amount enter reference enter pin code
P2P,ayoba validation code xi ivbrte
A2P,ayokunle akapo sent ghs airteltigo money account send receive money instantly expresspay www expaygh com app
A2P,az branch deposit ghs win amazing rewards save win promo
A2P,aziz purchased ghs airtime download palmpay get rewards buy airtime https palmpay page link kr
A2P,azumah purchased ghs airtime download palmpay get rewards buy airtime https palmpay page link kr
P2P,Baaaaaaaabe! Wake up ! I miss you ! I crave you! I need you!
P2P,Baaaaabe! I misss youuuuu ! Where are you ? I have to go and teach my class at 5 ...
P2P,"Babe ! How goes that day ? What are you doing ? Where are you ? I sip my cappuccino and think of you, my love ... I send a kiss to you from across the sea"
P2P,Babe ! What are you doing ? Where are you ? Who are you talking to ? Do you think of me ? Are you being a good boy? Are you missing me? Do you love me ?
P2P,BABE !!! I miiiiiiissssssssss you ! I need you !!! I crave you !!! :-( ... Geeee ... I'm so sad without you babe ... I love you ...
P2P,Babe !!!! I LOVE YOU !!!! *covers your face in kisses*
P2P,Babe ? I lost you ... :-(
P2P,Babe ? I lost you ... Will you try rebooting ?
P2P,babe abdul kudus tigo line call seen message 
P2P,babe phones trying reach kindly buy fabric glue pretty pls 
P2P,babe please realized data talk tomorrow god willing good night love 
P2P,"Babe! How goes that day ? What are you up to ? I miss you already, my Love ... * loving kiss* ... I hope everything goes well."
P2P,"Babe! I fucking love you too !! You know? Fuck it was so good to hear your voice. I so need that. I crave it. I can't get enough. I adore you, Ahmad *kisses*"
P2P,"Babe, have you got enough money to pick up bread and milk ? And I'll give you it back when you get home ?"
P2P,"Babe, I need your advice"
P2P,"Babe, I'm answering you, can't you see me ? Maybe you'd better reboot YM ... I got the photo ... It's great !"
P2P,"Babe, I'm back ... Come back to me ..."
P2P,Babe? You said 2 hours and it's been almost 4 ... Is your internet down ?
P2P,Babes I think I got ur brolly I left it in English wil bring it in 2mrw 4 u luv Franxx
P2P,"Babes, am at the airport ohh but their wifi can't connect. Will call u whn we get to Gh"
P2P,Babess Int Sch Your child ARYETEY  ELLEN has arrived at Babess International School at 2020-01-15 03:49 pm
P2P,baby arrived home safely thanks everything god richly bless shalom night love much 
P2P,baby data 
P2P,baby girl please call data wai 
P2P,BABy Is Me John Baby I Dont Hv Enough Tigo Credit Only Mtn So Let Me Call Ur Mtn Line Wai Pls
P2P,"Baby pls is me degree, pls i need 10gh from you wai pls, i beg u, can you give it to me?"
P2P,Back in brum! Thanks for putting us up and keeping us all and happy. See you soon 
A2P,back pass click link details http localhost nstacom new sms
P2P,Badrith is only for chennai:)i will surely pick for us:)no competition for him.
A2P,bal ghs north industrial area branch deposit ghs win amazing rewards save win promo
A2P,bal type debit
A2P,balance account ending ghs jan
A2P,balance account expire jan please top ghs
A2P,balance available stanbic account xx ghs
P2P,balance ghc account disabled simply reload able make calls lose current balance
P2P,Ball is moving a lot.will spin in last :)so very difficult to bat:)
P2P,ball mill running start time greenwich standard time gmt
A2P,ball mill running start time pm greenwich standard time gmt
P2P,ball wolves boss nuno espirito santo refused rule selling italian forward patrick cutrone month
A2P,"Ball: Miguel Angel Gil Marin, the chief executive of Atletico Madrid, was in Paris to negotiate a deal with PSG for their Uruguayan striker Edinson Cavani."
A2P,bank account balance ghs
A2P,bank account credited ghs curr bal ghs avail bal ghs trans id rw ref
A2P,Bank Gaborone DEPOSIT - CHK029931 of P4217.6 MAUN SALES on 2021-06-07 09:38:00 Help +267 3158681
A2P,Bank Gaborone WITHDRAWAL - CHK770392 of P79.8 KFC AIRPORT JUNCTION - GABORONE BW on 2021-06-07 13:12:00 Help +267 3158681
A2P,barbara okai tettey sent ghs airtime via expresspay click www expaygh com app send money buy airtime internet data go
A2P,barbara owusu sent ghs mtn mobile money account send receive money instantly expresspay www expaygh com app
A2P,Barcelona have been dealt a huge blow in their quest for success this season as Luis Suarez has been ruled out for four months after undergoing knee surgery.
A2P,barclaycard confirms transaction cad credit card ** anytime mailbox available purchase limit ghs
A2P,barclaycard confirms transaction eur credit card ** amznprime de available purchase limit ghs
A2P,basoah purchased ghs airtime download palmpay get rewards buy airtime https palmpay page link kr
P2P,bawjiasi cr battery theft alarm open
P2P,bawjiasi cr dc system door open alarm open
A2P,"Bayport invites you to a car auction at 10am April 18 at O. P. Soadwa Company Ltd, next to Homebase near the Achimota Hospital. Call 0577 680 666 for more info."
P2P,bbc several blasts shook baghdad area hours huge funeral procession top iranian general killed us air strike thursday
P2P,bbc sports phil foden made one goal scored another holders man city saw spirited port vale side book place th round fa cup
P2P,bbq lovers order delivery east legon branch
P2P,Bbq this sat at mine from 6ish. Ur welcome 2 come
P2P,bby pls vodafone want check mobile monie wat de code 
P2P,Be happy there. I will come after noon
A2P,be processed and paid by Botswana Life. For convenience
P2P,Be sure to check your yahoo email. We sent photos yesterday
A2P,beatrice dartey sent ghs mtn mobile money account send receive money instantly expresspay www expaygh com app
A2P,beatrice manigat sent ghs airtime via expresspay click www expaygh com app send money buy airtime internet data go
A2P,beatrice purchased ghs airtime download palmpay get rewards buy airtime https palmpay page link kr
A2P,"Beautiful tomorrow never comes.. When it comes, it's already TODAY.. In the hunt of beautiful tomorrow don't waste your wonderful TODAY.. GOODMORNING:)"
A2P,Beautiful truth : Expression of the face could Be seen by everyone... But the depression of heart Could be understood only By the Loved ones.. Gud Ni8;-)
A2P,Beautiful Truth against Gravity.. Read carefully:  Our heart feels light when someone is in it.. But it feels very heavy when someone leaves it..  GOOD NIGHT
A2P,Beautiful Truth against Gravity.. Read carefully:  Our heart feels light when someone is in it.. But it feels very heavy when someone leaves it..  GOODMORNING
A2P,Beauty sleep can help ur pimples too.
A2P,becos dis stupid behavior things mke slow thank much done kk 
A2P,Becoz its  &lt;#&gt;  jan whn al the post ofice is in holiday so she cn go fr the post ofice...got it duffer
A2P,Been running but only managed 5 minutes and then needed oxygen! Might have to resort to the roller option!
A2P,Been up to ne thing interesting. Did you have a good birthday? When are u wrking nxt? I started uni today.
P2P,Beerage?
P2P,befitting burial accorded late husband father may good lord continue keep safe sound yaw aidoo 
P2P,beg send gh dx 
A2P,begging pls try go fr gh send bcs lied uncle eback said withdraw gh said withdraw 
A2P,begin jesus locals mon tues take place wed frid dist level central district night prayers frid central district appraisal mtg mission hse today pm women ministry thanksgiving service evening central pm
A2P,begin relationship today find turn something long lasting beautiful may receive gift partner today
A2P,"Behind Ghana home loans, opposite the Elizabeth. Yellow house with black gate."
A2P,belinda danso sent ghs mtn mobile money account send receive money instantly expresspay www expaygh com app
A2P,belinda requests ghs please click https palmpay page link yodc send money
A2P,bellal helwani sent ghs mtn mobile money account send receive money instantly expresspay www expaygh com app
P2P,beloved tonite anointing divine favor drtn increase pm sharp glc tema dont miss one oh yurs glc tema
P2P,beloved warmly invite fellowship us tomorrow voice healing service hope honour us presence god bless
A2P,"Ben Ampofo, address is BLK 429 Room 12 Community 4 Tema Central district"
A2P,ben hornsby sent ghs airtime via expresspay click www expaygh com app send money buy airtime internet data go
A2P,ben nortey sent ghs mtn mobile money account send receive money instantly expresspay www expaygh com app
A2P,benedict afful sent ghs mtn mobile money account send receive money instantly expresspay www expaygh com app
A2P,beneficiary detail davis fred boateng added internet banking profile helpline
A2P,benewaa purchased ghs airtime download palmpay get rewards buy airtime https palmpay page link kr
P2P,bennie appenteng shs reminder school opens today students come nd fees gh arrear payment school fess made sefwiman rural bank limited branch name bennie appenteng shs branch sefwi boako hostel fees girl
A2P,berekum atm issue cash cassette warning cash cassette warning cassette type fatal cassette type media low
P2P,berekum atm issue cash cassette warning cassette type fatal cassette type media low
A2P,bernie anti sent ghs mtn mobile money account send receive money instantly expresspay www expaygh com app
A2P,beryl appenteng sent ghs mtn mobile money account send receive money instantly expresspay www expaygh com app
P2P,besilory bead est
P2P,Best line said in Love: .  I will wait till the day I can forget u Or The day u realize that u cannot forget me. ... Gn
P2P,"Best msg: It's hard to be with a person, when u know that one more step foward will make u fall in love.. &amp; One step back can ruin ur friendship.. good night:-) ..."
A2P,best roy sent ghs airtime via expresspay click www expaygh com app send money buy airtime internet data go
A2P,bestdan purchased ghs airtime download palmpay get rewards buy airtime https palmpay page link kr
A2P,bet chelsea spurs lfc fa cup la liga series matches today best odds multi bet bonus next big winner www mgabet combetpawa verification code need verify account need help offer whatsapp support
P2P,bet placed ref ghs alaves win ghs bal ghs betyetu com gh
P2P,bet placed ref ghs bologna draw win ghs bal ghs betyetu com gh
A2P,bet placed ref ghs bologna fiorentina win ghs bal ghs betyetu com gh
A2P,better tell yur mum truth tell mad asked gh get spoil name remember always pray pple destroy name 
A2P,"Better than bb. If he wont use it, his wife will or them doctor"
A2P,Better. Made up for Friday and stuffed myself like a pig yesterday. Now I feel bleh. But at least its not writhing pain kind of bleh.
A2P,Bienvenue sur le reseau de moov Benin. Profitez des meilleurs tarifs en Roaming pour rester en contact avec vos proches Infos au 888. Moov vous souhaite
P2P,Big brothers really scraped the barrel with this shower of social misfits
A2P,big time data mb expiry fuse minutes local calls mb fuse data fuse bundles expire
A2P,bile banking deposit ghs win amazing rewards save win promo
A2P,bill payment accepted customer id amount ghs trans id reference fg
A2P,bill paymnet ib airtime acct xxxxx credited ghs balance ghs use ghl mortgage buy house bijou homes www bijouhomesgh com
A2P,bill term grs koranteng addo nana ama tuition fee canteen extra classes exams music class medicals ict sports dues amt due
A2P,"Bill, as in: Are there any letters for me. im expecting one from orange that isnt a bill but may still say orange on it."
A2P,billing details acc acc name agyemang clement mobile email call whatsapp rectify error
P2P,billing details acc acc name offei akoto otiwaa mobile email call whatsapp rectify error
P2P,Bishan lar nearer... No need buy so early cos if buy now i gotta park my car...
A2P,bishop mummy pls help say big thank mommy blessed powerful miracle money ooo god bless family bishop im 
A2P,bismark purchased ghs airtime download palmpay get rewards buy airtime https palmpay page link kr
A2P,bit curr bal ghs avl bal ghs atm cards hotline complaints complaints firstatlanticbank com gh pcidss iso certified fab refreshingly different
A2P,bit ly umbspeedapp download umb speedapp today
P2P,biz government ghana would borrow ghs billion first quarter year dial jokes kwadwo nkansah liwin
A2P,bk bal ghs castle road branch deposit ghs win amazing rewards save win promo
P2P,Black shirt n blue jeans... I thk i c ü...
A2P,blackshield capital management ltd formerly gold coast fund management ltd univ cape coast branch information claim communicated due course kindly call require clarification thank yo
P2P,Blank is Blank. But wat is blank? Lol
P2P,Bless but u dawg me oo
P2P,bless tmoro first sunday ita day trumpets love thanksgiving ur white outfit victory start year wel
P2P,blessed day trust enjoying year want use opportunity invite special live service pastor chris tomorow time location near ultimate bar kiddicare school teshie century road please call numbers details
A2P,blessed day trust enjoying year want use opportunity invite special live service pastor chris tomorrow morning god bringing words position man god pastor chris run year see tomorrow
A2P,"Blessed is He Who, if He will, will assign thee better than (all) that - Gardens underneath which rivers flow and will assign thee mansions. Quran 25"
A2P,"Blessed morning Perfect one,  DAY 4 OF THE 7DAYS OF PRAYER AND FASTING WITH PASTOR FAITH!  There will be an IMPARTATION OF SPECIAL GRACES in our meeting "
A2P,blessed morning sarafina welcome join us service begin new year theme today rejoice lord delivers first sunday come let rejoice lord singing dancing prayer praise see basement arc hall
A2P,blessed new year cherished clients please informed short break monday th saturday th january
A2P,blessed one pre registration jan ers still ongoing closes soon please hurry left shining light soul mtbb
P2P,blessed week thank jerry 
P2P,Blessed you bro. Always at your service.
P2P,Blessing Attu-Obimpeh  Please that is the number. Thank You
A2P,blessing ehize sent ghs airtime via expresspay click www expaygh com app send money buy airtime internet data go
P2P,blessing shall room enough receive mal
P2P,"Bloody hell, cant believe you forgot my surname Mr . Ill give u a clue, its spanish and begins with m... "
P2P,"Blue International MR PRICE APPAREL - AIRPORT JUN: MR PRICE APPAREL - AIRPORT JUN 05 Jun 06:46   2021060505202 ILLEGAL OPENING 4 CHENESANI LETSHWENYO"""
